company_name,company_number,company_status,company_type,company_subtype,dissolution_date,incorporation_date,removed_date,registered_date,nature_of_business,registered_office_address
DAN HEMMINGTON LTD,09618271,Active,Private limited company,,,2015-06-02,,,59120,17 Mitchell Avenue Ventnor PO38 1DL England
CANIS AUTOMOTIVE LABS LTD,10316208,Active,Private limited company,,,2016-08-08,,,26110,45 Landguard Manor Road Shanklin PO37 7JD United Kingdom
MARINE GAS SOLUTIONS LTD,13643726,Active,Private limited company,,,2021-09-27,,,33150 71129,C/O 5 Holyrood Street Newport PO30 5AU England
PADFIELD COSTS RECOVERY MANAGEMENT AND ADVICE LIMITED,14363901,Active,Private limited company,,,2022-09-20,,,69109,10 Well Street Ryde PO33 2SG England
STYLISH PLASTICS LIMITED,05142006,Active,Private limited company,,,2004-06-01,,,43342 46760,"The Old Dairy, Long Lane Newport Isle Of Wight PO30 2NW "
FERNANDO PROPERTY GROUP LIMITED,15773643,Active,Private limited company,,,2024-06-12,,,68209,1b Howard Close Newport PO30 2LD United Kingdom
ARELEY KINGS DENTAL PRODUCTS LIMITED,14451433,Active,Private limited company,,,2022-10-31,,,68209 86230,Arnold House 2 New Road Brading Sandown PO36 0DT United Kingdom
RJ POTTINGER LIMITED,10209383,Active,Private limited company,,,2016-06-01,,,68209,The Woodlands Chine Avenue Shanklin PO37 6AQ England
P.B.M. & D. LIMITED,03775709,Active,Private limited company,,,1999-05-24,,,68100,"Unit 52, Branstone Business Park Stockmans Close Branstone Sandown PO36 0EQ England"
CYCLEISLAND COMMUNITY INTEREST COMPANY,11610015,Active,Private limited by guarantee without share capital,Community Interest Company (CIC),,2018-10-08,,,86900 93199 96040,"1 Adelaide Place Ryde PO33 3DP "
HAROLD HAYLES(YARMOUTH I.W.)LIMITED,00548845,Active,Private limited company,,,1955-05-07,,,30110 46900 96090,"The Quay Yarmouth Isle Of Wight PO41 0RS "
RYLSTONE TEA GARDENS LIMITED,09795060,Active,Private limited company,,,2015-09-25,,,56102,43 The Fairway Sandown PO36 9EG England
DEAN OTTLEY BUILDING CONTRACTORS LIMITED,05367555,Active,Private limited company,,,2005-02-17,,,41100 41201 41202,"C/O Apple Accountancy 5, Holyrood Street Newport PO30 5AU England"
BEACH COURT (IOW) LIMITED,08870027,Active,Private limited company,,,2014-01-30,,,55209,East Quay Kite Hill Wootton Bridge PO33 4LA United Kingdom
GREENBANK MANAGEMENT (ISLE OF WIGHT) COMPANY LIMITED,03910383,Active,Private limited company,,,2000-01-20,,,98000,"Flat 3, Greenbank St. Johns Road Wroxall Ventnor PO38 3EE England"
G & J RECEIVABLES MANAGEMENT SERVICES LTD,10126527,Active,Private limited company,,,2016-04-15,,,70229,Springwood Youngwoods Way Alverstone Garden Village Sandown PO36 0HF England
APE VAPE LIMITED,11023248,Active,Private limited company,,,2017-10-20,,,12000,"51 St James Street Newport PO30 1LQ "
PFDS CONSULTANCY LIMITED,11403148,Active,Private limited company,,,2018-06-07,,,70229,8 Solent Lawns Cowes PO31 8AX United Kingdom
HENRY JAMES CONSULTANCY SERVICES LIMITED,08460141,Active,Private limited company,,,2013-03-25,,,70221 70229,Exchange House St Cross Lane Newport PO30 5BZ England
LORDSHIP 454 LTD,15788227,Active,Private limited company,,,2024-06-19,,,42130 85590,2 Belvedere Street Ryde PO33 2JN United Kingdom
ISLAND SURVEY SYSTEMS LIMITED,02826861,Active,Private limited company,,,1993-06-14,,,71129,"Suncourt Playstreet Lane Ryde PO33 3LJ "
DECO CARPENTRY LTD,13169754,Active,Private limited company,,,2021-02-01,,,41100 41202,3 Laurel Estate Cowes PO31 7HW England
ADVANCED MARINE STRUCTURES LTD,03796374,Active,Private limited company,,,1999-06-25,,,22290,Highfields Gatehouse Road Upton Ryde PO33 4BS United Kingdom
SENTPLAZA LIMITED,06611885,Active,Private limited company,,,2008-06-05,,,68209,"SENTPLAZA LIMITED 2 Binstead Hall Quarr Road Ryde PO33 4EL "
CLASSIC YACHT EVENTS LTD,05042483,Active,Private limited company,,,2004-02-12,,,33150 52220,1 Langley Court Pyle Street Newport PO30 1LA United Kingdom
GRIBBLE LTD,12065788,Active,Private limited company,,,2019-06-24,,,62012,43 Castle Street Newport PO30 1NS England
ABBEYFIELD WEST WIGHT SOCIETY LIMITED,12304094,Active,Private limited by guarantee without share capital,,,2019-11-07,,,87300,"Abbeyfield House 6 The Avenue Totland Bay PO39 0DH "
PIKES LIMITED,05558169,Active,Private limited company,,,2005-09-08,,,01500 43999 55900 74902,Whiteoak House Whiteoak Road Newtown Newport PO30 4DQ England
MARK 13 SOFTWARE LIMITED,10217433,Active,Private limited company,,,2016-06-07,,,62020,Arnold House 2 New Road Brading PO36 0DT United Kingdom
NUTKINS RETREAT LTD,12534784,Active,Private limited company,,,2020-03-25,,,55209,Nutkins Retreat 4 Four Cottages Whippingham Road East Cowes PO32 6NG United Kingdom
MEMORIAL HALL ARTS & LEISURE COMPANY,04197076,Active,"Private Limited Company by guarantee without share capital, use of 'Limited' exemption",,,2001-04-09,,,93290,"Memorial Hall Avenue Road Freshwater PO40 9UU "
IHEARTBUTTONS LIMITED,07722187,Active,Private limited company,,,2011-07-29,,,74100,"38 Argyll Street Ryde PO33 3BY "
CHEAP THRILLS LIMITED,05137541,Active,Private limited company,,,2004-05-25,,,47610 47650 47789 95110,"8 Tennyson View Elm Lane Calbourne Newport PO30 4JS "
CONSIGLIA SERVICES LIMITED,04248438,Active,Private limited company,,,2001-07-09,,,70229,Languard Manor Languard Manor Road Shanklin PO37 7JB England
ATHERLEY COURT RESIDENTS COMPANY LIMITED,04240248,Active,Private limited company,,,2001-06-25,,,98000,"8 Gunville Road Newport PO30 5LB "
MANAGEMENT55 LIMITED,12759703,Active,Private limited company,,,2020-07-21,,,68209 68310 68320,55 Union Street Ryde Isle Of Wight PO33 2LG United Kingdom
CATERCYCLE LTD,13257583,Active,Private limited company,,,2021-03-10,,,47990,Unit 5a Enterprise Way Cowes PO31 8AP England
VECTIS REFRIGERATION LTD,09869867,Active,Private limited company,,,2015-11-12,,,43220,Unit 5a Enterprise Way Cowes PO31 8AP England
CROMWELL RECRUITMENT LTD,14353038,Active,Private limited company,,,2022-09-13,,,78109,25 Cromwell Avenue East Cowes PO32 6GD United Kingdom
PRISM STRATEGIC INTELLIGENCE LIMITED,10685813,Active,Private limited company,,,2017-03-23,,,63990,Olive Cottage Carpenters Road St Helens Ryde PO33 1YQ United Kingdom
WILL SQUIBB LIMITED,07291742,Active,Private limited company,,,2010-06-22,,,30120 74909,"Attrills Yard The Duver St Helens Ryde PO33 1YB "
KT1 INVESTMENTS LTD,15775745,Active,Private limited company,,,2024-06-13,,,68100 68201 68209 68320,East Quay Kite Hill Wootton Bridge Ryde PO33 4LA England
GEMS INK LTD,14780580,Active,Private limited company,,,2023-04-04,,,90030 96020,5 Holyrood Street Newport PO30 5AU United Kingdom
D WHITE SITE SERVICES LTD,10932076,Active,Private limited company,,,2017-08-24,,,70229,9 St John's Place Newport Isle Of Wight PO30 1LH United Kingdom
FARROW DEVELOPMENTS LIMITED,07250194,Active,Private limited company,,,2010-05-11,,,41100,Mandalay The Grove Bembridge PO35 5AE England
WELLOW (I.O.W.)FARMERS LIMITED,00962362,Active,Private limited company,,,1969-09-19,,,01110,"Manor Farm Wellow Yarmouth PO41 0TB "
ISLAND AND SOLENT PSYCHOLOGICAL THERAPIES LIMITED,05841815,Active,Private limited company,,,2006-06-09,,,86900,14 Nunwell Street Sandown PO36 9DE England
VECTAWARM (ISLE OF WIGHT) LIMITED,00961872,Active,Private limited company,,,1969-09-11,,,46740 47789,"28 Daish Way Newport Isle Of Wight PO30 5XJ "
HEADSTRONG EDUCATION LIMITED,12103270,Active,Private limited company,,,2019-07-15,,,85600,16 Station Avenue Sandown PO36 9BW England
CLASSIC IMAGE LIMITED,06935114,Active,Private limited company,,,2009-06-16,,,46480,"2, Hazelmount Paddock Ryde PO33 4HL "
CHLOE'S BEAUTY BAR LTD,15783462,Active,Private limited company,,,2024-06-17,,,96020,5 Holyrood Street Newport PO30 5AU United Kingdom
RNSSC LTD,13460258,Active,Private limited company,,,2021-06-16,,,41100 41202 43991 70229,16c Sandown Road Lake PO36 9JP England
ORCHARD COURT (SHANKLIN) MANAGEMENT COMPANY LIMITED,02545239,Active,Private limited company,,,1990-10-02,,,98000,"The Estate Office Beatrice Avenue East Cowes PO32 6LW "
RED ENSIGN LIMITED,05331078,Active,Private limited company,,,2005-01-12,,,82990,"105 Medina Village Bridge Road Cowes PO31 7LP "
YARMOUTH GUIDE & SCOUT SUPPORTERS ASSOCIATION,04326998,Active,"Private Limited Company by guarantee without share capital, use of 'Limited' exemption",,,2001-11-22,,,94990,Afton View Blackbridge Road Freshwater PO40 9QL England
SKYTEC STEEPLEJACK SERVICES LIMITED,03790919,Active,Private limited company,,,1999-06-16,,,43999,"Yards Hollow Chale Street, Chale Ventnor PO38 2HF "
HOUSE OF TREASURE (IOW) LIMITED,14575030,Active,Private limited company,,,2023-01-06,,,47770,52 Regent Street Shanklin PO37 7AE England
CHARRIANNA LIMITED,09261676,Active,Private limited company,,,2014-10-13,,,56102,Vision Accounting Fortis House Cothey Way Ryde PO33 1QT England
THE HOT BOX BAKERY (IW) LIMITED,14844716,Active,Private limited company,,,2023-05-03,,,56101,Office 1 Rill Farm Canteen Road Whiteley Bank PO38 3AF United Kingdom
BOATRIDZ LIMITED,10162539,Active,Private limited company,,,2016-05-04,,,74990,Caryn March Accountants Limited 7 St. Edmunds Walk Wootton Bridge Ryde PO33 4JB England
SAMANTHA COURT (SHANKLIN) MANAGEMENT COMPANY LIMITED,01902768,Active,Private limited company,,,1985-04-04,,,98000,"The Estate Office Beatrice Avenue East Cowes PO32 6LW "
SPENCER RIGGING LIMITED,01614521,Active,Private limited company,,,1982-02-17,,,96090,"Empire Buildings St Marys Road Cowes PO31 7SX "
SOMATIC THERAPEUTIC YOGA TRAINING LTD,14869394,Active,Private limited company,,,2023-05-15,,,85510,Arnold House 2 New Road Brading Sandown PO36 0DT United Kingdom
MARTELS WHOLESALERS LIMITED,10869004,Active,Private limited company,,,2017-07-17,,,46439 46499,52 Mayfield Drive Newport PO30 2DR England
CRACKNELL PROFESSIONAL SERVICES LTD,11295434,Active,Private limited company,,,2018-04-06,,,10710 32990 47730 47910,Innovation Centre St Cross Business Park Newport PO30 5WB England
PDH COSTING & PRICING LIMITED,08792460,Active,Private limited company,,,2013-11-27,,,96090,Exchange House St Cross Lane Newport PO30 5BZ England
J.S MARINE FABRICATIONS LTD,09589211,Active,Private limited company,,,2015-05-13,,,30110,11 The Avenue Gurnard Cowes PO31 8JL England
ARTECOLOGY LTD,09627221,Active,Private limited company,,,2015-06-08,,,74901,The Bunker Offices At Browns Golf Course Yaverland Sandown PO36 8QA England
SURENAV LTD,10967009,Active,Private limited company,,,2017-09-18,,,74909,Royal Maritime House St. Thomas Street Ryde PO33 2DL England
ASPERITI GROUP LIMITED,06662860,Active,Private limited company,,,2008-08-04,,,62090,153 Old Road East Cowes PO32 6AX England
RYDE BUSINESS PARK MANAGEMENT COMPANY LIMITED,02944269,Active,Private limited company,,,1994-06-30,,,98000,"The Estate Office Church Mews Beatrice Avenue East Cowes PO32 6LW "
INDIGO MARINE LTD,14162305,Active,Private limited company,,,2022-06-09,,,33150,Vision Accounting Fortis House Cothey Way Ryde PO33 1QT England
ISLAND LETTINGS LIMITED,06929524,Active,Private limited company,,,2009-06-10,,,68320,The Observatory Westridge Business Park Ryde PO33 1FX England
DOGGY PADDLES LIMITED,03536134,Active,Private limited company,,,1998-03-27,,,96090,"White Rails White Rails Road Wootton Bridge Isle Of Wight PO33 4RN "
BREATHE LIMITED,04036619,Active,Private limited company,,,2000-07-19,,,96040,Arnold House 2 New Road Brading Sandown PO36 0DT United Kingdom
ML CHIROPRACTIC LTD,06838227,Active,Private limited company,,,2009-03-05,,,86900,"South Court Newport Road Niton Ventnor, Isle Of Wight PO38 2DQ England"
HONG KONG EXPRESS IOW NEWPORT LTD,14406483,Active,Private limited company,,,2022-10-09,,,56101,Harvey's Holyrood Street Newport PO30 5EP England
GODDARDS BREWERY LIMITED,02338202,Active,Private limited company,,,1989-01-24,,,11050,The Brewery Branstone Farm Hale Common Sandown PO36 0LT England
UPWOOD HOUSE MANAGEMENT COMPANY LIMITED,06362214,Active,Private limited company,,,2007-09-05,,,68320,"Quarr Hill Cottage Quarr Hill Ryde PO33 4EH "
SHANKLIN (HIGH STREET) MANAGEMENT COMPANY LIMITED,05368125,Active,Private limited by guarantee without share capital,,,2005-02-17,,,68320,Island Lettings The Observatory Westridge Business Park Ryde PO33 1FX England
ALVAS CONSULTING LTD,07814491,Active,Private limited company,,,2011-10-18,,,62020,Arnold House 2 New Road Brading Sandown PO36 0DT England
HOTEL MIKE LIMITED,07871836,Active,Private limited company,,,2011-12-06,,,62020,"Old Yafford Farm Mill Lane Yafford Newport PO30 3LH "
STONEHAM CONSTRUCTION LIMITED,02528618,Active,Private limited company,,,1990-08-07,,,41201 41202,"9 St Johns Place Newport Isle Of Wight PO30 1LH "
SHARMANY DEVELOPMENTS LIMITED,09614876,Active,Private limited company,,,2015-05-29,,,41100,Little Gables High Street Godshill Ventnor PO38 3HH United Kingdom
THE YARMOUTH BARBERS PROPERTY LIMITED,12383338,Active,Private limited company,,,2020-01-02,,,68209,Jireh Place Jireh Place Market Square Yarmouth PO41 0NR England
BEMBRIDGE INVESTMENTS LIMITED,04246230,Active,Private limited company,,,2001-07-04,,,41100,"Baie House Yarmouth Isle Of Wight PO41 0ND "
GOOD KARMA MEDIA LIMITED,12082687,Active,Private limited company,,,2019-07-03,,,73110,69 St. Johns Road Newport PO30 1LW England
CHAPEL COURT (NEWPORT) MANAGEMENT COMPANY LIMITED,06345899,Active,Private limited company,,,2007-08-17,,,98000,"8 Gunville Road Newport PO30 5LB "
ROSS REALTY LIMITED,03969176,Active,Private limited company,,,2000-04-10,,,41100,"Exchange House, St. Cross Lane Newport Isle Of Wight PO30 5BZ "
SEAVIEW FINANCIAL SERVICES LIMITED,08618737,Active,Private limited company,,,2013-07-22,,,66190,"44 Gregory Avenue Pondwell Ryde PO33 1PZ "
SOLENT PROPERTY INVESTMENTS LTD,10843183,Active,Private limited company,,,2017-06-30,,,68100 68201 68209 68320,22 Grange Road Shanklin PO37 6NN England
OJM PROPERTIES (IOW) LIMITED,13971429,Active,Private limited company,,,2022-03-11,,,68209,San Bernardino Swains Road Bembridge PO35 5XS England
THE FURLONGS (WESTERGATE) MANAGEMENT COMPANY LIMITED,11022360,Active,Private limited by guarantee without share capital,,,2017-10-19,,,98000,128 Pyle Street Newport PO30 1JW England
ISLAND STRUCTURAL LIMITED,03256768,Active,Private limited company,,,1996-09-30,,,25990,"Bowcombe Works Bowcombe Newport PO30 3HZ "
FAIRY HILL PRODUCTIONS LTD,11490150,Active,Private limited company,,,2018-07-30,,,73120 82110,2 Southview Wellow Top Road Wellow Yarmouth PO41 0TA England
SPECTRAL SOLUTIONS LIMITED,04492710,Active,Private limited company,,,2002-07-23,,,61900 62020 70229,Arnold House 2 New Road Brading PO36 0DT United Kingdom
SOMA SPACE LTD,15021671,Active,Private limited company,,,2023-07-24,,,90010 93130,Arnold House 2 New Road Brading Sandown PO36 0DT England
CLOVER COURT RESIDENTS ASSOCIATION LIMITED,02640644,Active,Private limited company,,,1991-08-23,,,98000,"The Estate Office Church Mews Beatrice Avenue East Cowes PO32 6LW "
THREE RIVERS WELL BEING CENTRE LTD,15031247,Active,Private limited company,,,2023-07-26,,,55300,20 Brook Road Shanklin PO37 7LU United Kingdom
CODE COG CONSULTING LIMITED,06486256,Active,Private limited company,,,2008-01-28,,,62020,Arnold House 2 New Road Brading Sandown PO36 0DT England
KDB INVESTMENTS LIMITED,15863286,Active,Private limited company,,,2024-07-29,,,68209,"3 Garfield Road Ryde PO33 2PS "
THE LINEN COMPANY (IOW) LTD,12495092,Active,Private limited company,,,2020-03-03,,,81222,61 Marlborough Road Ryde PO33 1AF England
ISLE OF WIGHT INTERIOR DESIGNS LTD,10890876,Active,Private limited company,,,2017-07-31,,,74100,61 Marlborough Road Ryde PO33 1AF England
STAPLES & GREEN LIMITED,07985579,Active,Private limited company,,,2012-03-12,,,47599,"15 Shooters Hill Cowes PO31 7BG "
PRIME RESIDENTIAL PROPERTY LTD,15864290,Active,Private limited company,,,2024-07-29,,,68310,"Unit 4, 13, Baring Chambers Denmark Road Cowes PO31 7SY United Kingdom"
SIMON NEWMAN SOFTWARE DEVELOPMENT LIMITED,10406193,Active,Private limited company,,,2016-10-01,,,62012,318 Park Road Cowes PO31 7NN United Kingdom
YARBOROUGH ROAD (EAST COWES) MANAGEMENT LIMITED,06700437,Active,Private limited by guarantee without share capital,,,2008-09-17,,,68320,"27 Horestone Drive Seaview PO34 5DD "
SHAMROCK VILLA 1861 LIMITED,06742110,Active,Private limited company,,,2008-11-05,,,68320,"Flat 4 33 Queens Road Cowes PO31 8BW "
THE JACKSON FAMILY LTD,03217841,Active,Private limited company,,,1996-06-27,,,62090 72190 85310 90020,"57,Mill Hill Road Cowes Isle Of Wight PO31 7EG "
MERRIE GARDENS LIMITED,05727377,Active,Private limited company,,,2006-03-02,,,68100,"Unit 18 Prospect Business Centre Prospect Road Cowes PO31 7AD "
JAMES DIXON TRAINING LTD,12183332,Active,Private limited company,,,2019-09-02,,,93199,24 Ninham Close Shanklin PO37 7EP England
WIGHT-ECO CLEAN LTD.,09000836,Active,Private limited company,,,2014-04-16,,,81222,Innovation Centre St Cross Business Park Newport PO30 5WB England
ZEN SPA LTD,09348152,Active,Private limited company,,,2014-12-09,,,96020,35 Fleet Way Fleet Way Shalfleet Newport PO30 4PR England
APPLIED PHENOMICS LTD,10258897,Active,Private limited company,,,2016-06-30,,,86220,East Quay Kite Hill Wootton Bridge PO33 4LA United Kingdom
ISLAND CLINICAL ACADEMIC SERVICE LTD,09260667,Active,Private limited company,,,2014-10-13,,,86210,"1 Crescent Road Shanklin PO37 6DH "
THE GRANGE AT BEMBRIDGE RIGHT TO MANAGE COMPANY LIMITED,06962269,Active,Private limited by guarantee without share capital,,,2009-07-14,,,98000,"The Estate Office Beatrice Avenue Church Mews Whippingham East Cowes PO32 6LW "
3I CONSULTANCY LTD,04633608,Active,Private limited company,,,2003-01-10,,,86900,"Oakhill Oakhill Road Seaview PO34 5AP "
STEVE PAYNE PROPS LTD,09750062,Active,Private limited company,,,2015-08-26,,,59111,5 Holyrood Street Newport PO30 5AU England
ALBATROS TOWING LTD,08693536,Active,Private limited company,,,2013-09-17,,,52290,"Exchange House St. Cross Lane Newport PO30 5BZ "
IWSO PRODUCTIONS LIMITED,11410923,Active,Private limited company,,,2018-06-12,,,90010,"24 Nelson Street Ryde PO33 2EZ "
SOLENT COMMUNITY RAIL PARTNERSHIP CIC,11913568,Active,Private limited by guarantee without share capital,Community Interest Company (CIC),,2019-03-29,,,49390,"3 Downside Ventnor PO38 1AL "
SOUTH-WIGHT PROPERTIES LTD,08741181,Active,Private limited company,,,2013-10-21,,,68310,East Quay Kite Hill Wootton Bridge PO33 4LA United Kingdom
GORDON HOUSE MANAGEMENT LIMITED,05187145,Active,Private limited company,,,2004-07-22,,,68320,"Gordon House South Street Yarmouth PO41 0QB "
VENTNOR EXCHANGE TRADING COMPANY LIMITED,08812791,Active,Private limited company,,,2013-12-12,,,90030,"11 Church Street Ventnor PO38 1SW "
REMEDY FOR MEDIA LIMITED,10227993,Active,Private limited company,,,2016-06-13,,,70229,8 Brigstocke Terrace Ryde PO33 2PD United Kingdom
ANNIEANNE LIMITED,09256772,Active,Private limited company,,,2014-10-09,,,14132,"4 Mulberry Close Newport PO30 5EY "
FORTIS HOUSE LIMITED,08123327,Active,Private limited company,,,2012-06-28,,,68209,"Fortis House Cothey Way, Ryde PO33 1QT United Kingdom"
LILLYJAMES LIMITED,09287158,Active,Private limited company,,,2014-10-29,,,68201,"Vision Accounting, Fortis House Cothey Way Ryde PO33 1QT England"
VENTNOR CRICKET CLUB TRADING LIMITED,05880834,Active,Private limited company,,,2006-07-19,,,93120,"Ventnor Cricket Club Steephill Road Ventnor PO38 1UF "
ROUSE LIMITED,03501806,Active,Private limited company,,,1998-01-30,,,66190 66220,Lugley House Lugley Street Newport PO30 5EL England
R A DAISH AND SONS LIMITED,04245993,Active,Private limited company,,,2001-07-04,,,41202,"C/O A H Cross & Co 16 Quay Street Newport PO30 5BG "
KROWN HOLDINGS LTD,15009166,Active,Private limited company,,,2023-07-18,,,41100,The Annex Northumberland Road Newport PO30 5SA United Kingdom
VENTNOR CRICKET CLUB LIMITED,07286116,Active,Private limited by guarantee without share capital,,,2010-06-16,,,93120,"Ventnor Cricket Club Steephill Road Ventnor PO38 1UF "
WILLIAMS ASSOCIATES (SOUTHERN) LIMITED,03603899,Active,Private limited company,,,1998-07-24,,,42990,"Williams Associates(Southern) Ltd St. Georges Down Blackwater Newport PO30 3BX "
ONE WAY OR ANOTHER LIMITED,08596032,Active,Private limited company,,,2013-07-04,,,78300,Exchange House St Cross Lane Newport PO30 5BZ England
ELDRIDGES LEGAL SERVICES LIMITED,13030817,Active,Private limited company,,,2020-11-19,,,69102,36 St James Street Newport PO30 1LF England
JO HUMMEL LTD,13890265,Active,Private limited company,,,2022-02-03,,,90030,Vision Accounting Fortis House Cothey Way Ryde PO33 1QT United Kingdom
GROVE HOUSE MANAGEMENT (VENTNOR) LIMITED,04600684,Active,Private limited company,,,2002-11-26,,,98000,"Grove House Surgery Albert Stret Ventor PO38 1EU "
VICTORIA COURT MANAGEMENT (COWES) LIMITED,01397754,Active,Private limited by guarantee without share capital,,,1978-11-03,,,98000,"1 Victoria Court ., York Avenue , East Cowes Isle Flat 1 Victoria Court York Avenue East Cowes PO32 6QR England"
ROSALI HOUSE MANAGEMENT COMPANY LIMITED,06310847,Active,Private limited company,,,2007-07-12,,,98000,"8 Gunville Road Newport PO30 5LB "
THIRSTY BEAR SOFTWARE LIMITED,05442181,Active,Private limited company,,,2005-05-04,,,62020,Arnold House 2 New Road Brading Sandown PO36 0DT England
TAYLOR & LONG PLUMBING & HEATING LTD,11014711,Active,Private limited company,,,2017-10-16,,,43220,Unit 32 Pondacre Farm Yarmouth Road Newport PO30 4LZ England
THE RED SEAGULL LIMITED,10997234,Active,Private limited company,,,2017-10-05,,,56103,36 Union Street Ryde PO33 2LE England
CHEVERTON COPSE HOLIDAY PARK LIMITED,04499757,Active,Private limited company,,,2002-07-31,,,55300,1 Langley Court Pyle Street Newport PO30 1LA United Kingdom
DIGITAL DESTINATION LTD,06977607,Active,Private limited company,,,2009-07-31,,,70210,35 Orchard Street Newport PO30 1JZ England
MATERIALSBYPOST LTD,09925568,Active,Private limited company,,,2015-12-22,,,47910,The Green Hangar Scotchells Brook Lane Sandown PO36 0JP United Kingdom
CARISBROOKE PRIORY TRUST COMPANY LIMITED,06624300,Active,Private limited by guarantee without share capital,,,2008-06-19,,,94910,"39 Whitcombe Road Newport PO30 1YS "
ERGO INVESTMENTS LTD,10848672,Active,Private limited company,,,2017-07-04,,,68100 68209 68320,Shafleet House Main Road Newport PO30 4NS England
WILMAR LODGE (LAKE) MANAGEMENT COMPANY LIMITED,01567826,Active,Private limited company,,,1981-06-12,,,98000,16c Sandown Road Lake PO36 9JP England
GREENFLOW ELECTRICAL LIMITED,15023969,Active,Private limited company,,,2023-07-24,,,43210,"3 Coastguard Cottages Military Road, Brighstone Newport PO30 4DA United Kingdom"
PERRY PROPERTIES (IW) LIMITED,11498410,Active,Private limited company,,,2018-08-03,,,41100,9 St John's Place Newport Isle Of Wight PO30 1LH United Kingdom
COUNTRY PROMOTIONS LIMITED,05099548,Active,Private limited company,,,2004-04-13,,,93290,Littlecombe Sandy Way Shorwell Newport PO30 3LN England
FRESHWATER INSTRUMENT CONTROL AND AUTOMATION LIMITED,08167960,Active,Private limited company,,,2012-08-03,,,71121,1 Langley Court Pyle Street Newport PO30 1LA United Kingdom
"27 JOHN STREET, RYDE. MANAGEMENT LTD",10313256,Active,Private limited by guarantee without share capital,,,2016-08-04,,,98000,"Flat 3, 27 John Street Ryde PO33 2PZ "
MEDINA VALLEY CENTRE LIMITED,00809637,Active,Private limited by guarantee without share capital,,,1964-06-18,,,55900 85590,"Dodnor Lane Newport Isle Of Wight PO30 5TE "
INFLIGHT PERIPHERALS LIMITED,03237153,Active,Private limited company,,,1996-08-13,,,52230,Ifpl Elm Lane Calbourne Newport PO30 4JY England
LANDSCAPE THERAPY LIMITED,03582788,Active,Private limited company,,,1998-06-17,,,81300,East Quay Kite Hill Wootton Bridge PO33 4LA England
BELMONT PARK PROPERTIES LTD,13108765,Active,Private limited company,,,2021-01-04,,,68209,22 22 Meadow Drive Bembridge PO35 5YA United Kingdom
PREZIOSA TRAINING ACADEMY LTD,15080294,Active,Private limited company,,,2023-08-18,,,85590,132 Fairlee Road Newport PO30 2EN United Kingdom
BRETT & CO INCORPORATED LIMITED,09309471,Active,Private limited company,,,2014-11-13,,,74909,Arnold House 2 New Road Brading Sandown PO36 0DT England
DANECOURT (SHANKLIN IOW) MANAGEMENT COMPANY LIMITED,02328538,Active,Private limited company,,,1988-12-14,,,98000,"8 Gunville Road Newport PO30 5LB "
75 MONKTON STREET RESIDENTS COMPANY LIMITED,04043682,Active,Private limited company,,,2000-07-31,,,98000,"8 Gunville Road Newport PO30 5LB "
KEENMEDIA LIMITED,15880474,Active,Private limited company,,,2024-08-06,,,82990,Office 4 Baring Chambers 13 Denmark Road Cowes PO31 7SY United Kingdom
ALWR LTD,12610685,Active,Private limited company,,,2020-05-19,,,68209,1 Admiral Way Cowes PO31 7FL United Kingdom
ABBRA SOLUTIONS LIMITED,08025049,Active,Private limited company,,,2012-04-11,,,70229,4 Silver Trees Shanklin PO37 7ND United Kingdom
HOOMEE LIMITED,10231104,Active,Private limited company,,,2016-06-14,,,56101,Lu Shan Sherbourne Street Bembridge PO35 5RZ United Kingdom
ISLAND HIRE CENTRE LIMITED,04526828,Active,Private limited company,,,2002-09-05,,,82990,East Quay Kite Hill Wootton Bridge PO33 4LA United Kingdom
GREEN APPLE DEVELOPMENTS LTD,12234777,Active,Private limited company,,,2019-09-30,,,41100,14 Medina Avenue Newport PO30 1EJ England
TT PROTECTION LTD,14919684,Active,Private limited company,,,2023-06-07,,,80200,7b St Peters Mews George St Ryde PO33 2LB United Kingdom
GLENHOLME RTM COMPANY LIMITED,08341162,Active,Private limited by guarantee without share capital,,,2012-12-24,,,98000,27 Ashey Road Ryde PO33 2UW England
WIGHT & WEST COUNTRY DEVELOPMENTS LIMITED,01854262,Active,Private limited company,,,1984-10-10,,,01500 41100 68209,Moorfield Khela Chilton Lane Brighstone PO30 4DR England
WATSON PORTLOCK LIMITED,10982409,Active,Private limited company,,,2017-09-26,,,70221 70229,2 Aspen Gardens Ryde PO33 1RE United Kingdom
