company_name,company_number,company_status,company_type,company_subtype,dissolution_date,incorporation_date,removed_date,registered_date,nature_of_business,registered_office_address
CC RECRUITMENT LIMITED,09975274,Active,Private limited company,,,2016-01-28,,,78109 78300,Old Walls Tennyson Road Yarmouth PO41 0QJ United Kingdom
FIRBANK LODGE (SHANKLIN) MANAGEMENT COMPANY LIMITED,02474472,Active,Private limited company,,,1990-02-26,,,98000,"The Estate Office Church Mews Whippingham PO32 6LW "
OH SO CHERISHED LTD,11930294,Active,Private limited company,,,2019-04-08,,,47990,1 Langley Court Pyle Street Newport PO30 1LA England
DUBAI FINE ART GALLERY LTD,16208908,Active,Private limited company,,,2025-01-27,,,47781 90030,4a High Street Sandown PO36 8DA United Kingdom
UK SPRAYFOAM REMOVAL LTD,14799235,Active,Private limited company,,,2023-04-13,,,81222,109 Sandcroft Avenue Ryde PO33 2TU England
BOOKING READY LIMITED,15427316,Active,Private limited company,,,2024-01-19,,,68320,Cubs Cottage 1 Seymour Place Bembridge PO35 5NW England
PECKS LIMITED,05338014,Active,Private limited company,,,2005-01-20,,,46210 47789 49410,"Long Lane Newport Isle Of Wight PO30 2NW "
ISLE OF WIGHT TRANSPORT LTD,07478781,Active,Private limited company,,,2010-12-29,,,49410,"232 Newport Road Cowes PO31 8PE "
PETITE FAIRYTALE BOUTIQUE LIMITED,12308493,Active,Private limited company,,,2019-11-11,,,47190,1 Yarborough Road Wroxall PO38 3EA England
TESTAMENT ESTATES LIMITED,16164932,Active,Private limited company,,,2025-01-06,,,68100 68209 68320,75 Captains Parade East Cowes PO32 6GU England
LIMEWOOD PROPERTY DEVELOPMENTS LIMITED,08979916,Active,Private limited company,,,2014-04-04,,,41100,C/O Ewc Accountants Office 4 Baring Chambers Denmark Road Cowes PO31 7SY United Kingdom
ISLE OF WIGHT RUGBY LIMITED,08966447,Active,Private limited by guarantee without share capital,,,2014-03-28,,,93120,East Quay Kite Hill Wootton Bridge PO33 4LA United Kingdom
LAKEMOOR (ISLE OF WIGHT) LTD,16216468,Active,Private limited company,,,2025-01-29,,,99999,Roosters Upper Hyde Farm Lane Shanklin PO37 7PS United Kingdom
NITON INVESTMENTS LIMITED,16216559,Active,Private limited company,,,2025-01-29,,,68100,"Trigg House, Monks Brook St Cross Business Centre Newport PO30 5WB England"
REW VALLEY DAIRIES (RETAIL) LIMITED,01963944,Active,Private limited company,,,1985-11-22,,,46330 47110,Macketts Farm Macketts Lane Hale Common Newport PO30 3AS England
DOG FURIENDLY LTD,12220891,Active,Private limited company,,,2019-09-21,,,79110 79909,29 Godric Road Newport PO30 2FP England
ROUTEFIFTY 7 LIMITED,09569008,Active,Private limited company,,,2015-04-30,,,77110 93290,The Homestead The Homestead Elm Close Seaview PO34 5ED United Kingdom
PADDLEBOARDING LONDON LTD,13303711,Active,Private limited company,,,2021-03-30,,,85510,Arnold House 2 New Road Brading Sandown PO36 0DT United Kingdom
STAGEGEAR RENTALS LIMITED,10690114,Active,Private limited company,,,2017-03-24,,,77390,Stagegear Rentals Ltd Prospect Road Cowes PO31 7AD England
FARMHOUSE FAYRE (NEWPORT) LIMITED,05773242,Active,Private limited company,,,2006-04-06,,,46310,East Quay Kite Hill Wootton Bridge PO33 4LA United Kingdom
ACAINN LTD,07966345,Active,Private limited company,,,2012-02-27,,,70229,1 Somerset Road Ryde PO33 1BU England
THE MEETING POD COMPANY LTD,09952961,Active,Private limited company,,,2016-01-15,,,74100,Pod Hq 117 Medina Avenue Newport PO30 1HG England
RICHMONDS BAKERY RYDE LTD,16059289,Active,Private limited company,,,2024-11-04,,,96090,95-96 St. James Street Newport PO30 1HY England
VISTA MANAGEMENT (IW) LIMITED,03917144,Active,Private limited by guarantee without share capital,,,2000-02-01,,,98000,"The Estate Office Church Mews Whippingham East Cowes PO32 6LW "
VECTIS HOTELS LIMITED,03532028,Active,Private limited company,,,1998-03-20,,,41100 55100,Arno House Park Avenue Ventor PO38 1LE United Kingdom
G & V HAWKINS LIMITED,06851292,Active,Private limited company,,,2009-03-18,,,47220,Office 4 Baring Chambers Denmark Road Cowes PO31 7SY England
MALTMANS LIMITED,11179150,Active,Private limited company,,,2018-01-31,,,58190,Kingsmead Unit 2 East Yar Industrial Estate Sandown PO36 9AX England
C4 HOMES LIMITED,06475408,Active,Private limited company,,,2008-01-16,,,41202,Office 4 Baring Chambers Denmark Road Cowes PO31 7SY England
RYDE MOTORS (ISLE OF WIGHT) LIMITED,02469743,Active,Private limited company,,,1990-02-13,,,45112,"The Coach House 31 Alexander Road Ryde PO33 1LT "
R P L CONSTRUCTION LIMITED,05393942,Active,Private limited company,,,2005-03-16,,,82990,Rpl Construction Ltd Unit 5d Riverway Newport PO30 5UX England
LNG TECHNOLOGY LIMITED,16210650,Active,Private limited company,,,2025-01-27,,,62020,Arnold House 2 New Road Brading Sandown PO36 0DT England
PUMPCRETE (SOUTHERN) LTD,14515615,Active,Private limited company,,,2022-11-30,,,43999,93 Noke Common Newport PO30 5TY England
PARK FARM RYDE MANAGEMENT COMPANY LIMITED,08977151,Active,Private limited company,,,2014-04-03,,,68320,The Crows Nest Park Farm Bullen Road Ryde PO33 1QE England
ZEEKOEVLEI MANAGEMENT LTD,10332849,Active,Private limited company,,,2016-08-17,,,82990,7 Quarry Stone Close Binstead PO33 3ET England
ANU NATURAL BEAUTY LTD,11930348,Active,Private limited company,,,2019-04-08,,,96040,1 Lane End Road Bembridge PO35 5UE England
WHISTLE CLEAN LTD,15447012,Active,Private limited company,,,2024-01-27,,,43999,6 Middleton Terrace Cross Street Cowes PO31 7TE United Kingdom
IGNITE CUSTOMS LTD,12949810,Active,Private limited company,,,2020-10-14,,,73110,Vision Accounting Fortis House Cothey Way Ryde PO33 1QT United Kingdom
LAKE ASSOCIATES LTD,09010833,Active,Private limited company,,,2014-04-25,,,52290,"15 Araluen Way Sandown Isle Of Wight PO36 8PP "
FRIENDINABOX LTD,09414240,Active,Private limited company,,,2015-01-30,,,47990,Lansdowne House 2 John Street Ryde PO33 2PZ United Kingdom
PISTACHIO PRODUCTION LTD,13797098,Active,Private limited company,,,2021-12-13,,,90030,Vision Accounting Fortis House Cothey Way Ryde PO33 1QT England
THE ISLE OF WIGHT BISCUIT COMPANY LTD,15338739,Active,Private limited company,,,2023-12-09,,,10890,Lessland Farm Lessland Lane Sandford PO38 3AS England
LJ CARPENTRY AND PROPERTY SERVICES LTD,15308672,Active,Private limited company,,,2023-11-24,,,43999,6 Elm Grove Weston Road Totland Bay PO39 0HA United Kingdom
POWERSURE CONNECTIONS LIMITED,07867048,Active,Private limited company,,,2011-12-01,,,26110,Unit 1 Atlantis Court Nicholson Road Ryde PO33 1FB United Kingdom
NEWNHAM WOOD LTD,15390933,Active,Private limited company,,,2024-01-05,,,02100 02200,Kemphill House Stroud Wood Road Ryde PO33 4BZ United Kingdom
HOUSE OF ZABRE LLP,OC416491,Active,Limited liability partnership,,,2017-03-22,,," ",12 Union Street Ryde PO33 2DU United Kingdom
FLORENCE VIEW COURT MANAGEMENT COMPANY LIMITED,01749188,Active,Private limited company,,,1983-08-31,,,98000,"Florence View Court 38 Alexandra Road Ryde PO33 1DT "
ALP BRICKWORK & BUILDING LTD,09962820,Active,Private limited company,,,2016-01-21,,,41100,Larachbeg Wellow Top Road Ningwood Yarmouth PO41 0TL England
DIAMOND ADVENTURES LIMITED,14569843,Active,Private limited company,,,2023-01-04,,,79120,Building 41 Newport Road Cowes PO31 8BX United Kingdom
W.L. AND D. SHURMER LIMITED,00855553,Active,Private limited company,,,1965-07-29,,,68209,Long Lee Main Road Thorley Yarmouth PO41 0SX England
WIGHT BIKE ECO-SOLUTIONS LIMITED,10151404,Active,Private limited company,,,2016-04-27,,,47640,1 Langley Court Pyle Street Newport PO30 1LA England
VOKINS 2000 LIMITED,04593216,Active,Private limited company,,,2002-11-18,,,68201,"3 Garfield Road Ryde Isle Of Wight PO33 2PS "
ADAM WALES ASSOCIATES LTD,12618910,Active,Private limited company,,,2020-05-22,,,68320,23 Coronation Avenue Northwood PO31 8PN England
JJJOG COFFEE LIMITED,14704047,Active,Private limited company,,,2023-03-03,,,47190,19 Grange Road East Cowes PO32 6EA England
COMMERCIAL AND INDUSTRIAL SERVICES ISLE OF WIGHT LIMITED,07350301,Active,Private limited company,,,2010-08-19,,,43390,"The Old Slaughterhouse Green Lane Ashey Road Ryde PO33 4BB "
KERBASCEND LIMITED,11612519,Active,Private limited company,,,2018-10-09,,,30920,Little Gables High Street Godshill Ventnor PO38 3HH United Kingdom
CORSZA LIMITED,14517716,Active,Private limited company,,,2022-12-01,,,73110,Office 2 Faulkner Lane Sandown Isle Of Wight PO36 9AZ England
TREECARE IW LIMITED,04710184,Active,Private limited company,,,2003-03-25,,,02100,"42 West Street Newport PO30 1PR "
DIGITAL WIGHT LTD,06519195,Active,Private limited company,,,2008-02-29,,,74100,"8 Southfield Gardens Haylands Ryde PO33 3EE "
OEA ALTERNATIVE PROVISION LTD,12247868,Active,Private limited company,,,2019-10-07,,,93199,Vision Accounting Fortis House Cothey Way Ryde PO33 1QT England
MADELEINE BENJAMIN LIMITED,08931057,Active,Private limited company,,,2014-03-10,,,62020,Arnold House 2 New Road Brading Sandown PO36 0DT England
SHANKLIN ESPLANADE LIMITED,04905751,Active,Private limited company,,,2003-09-19,,,55100,"Eastmount Hotel 10 East Mount Road Shanklin PO37 6DN "
ISLE OF WIGHT DISTRIBUTION LIMITED,04318171,Active,Private limited company,,,2001-11-07,,,49410 53202,"Isle Of Wight Distribution Ltd Unit 2 Newbarn Business Park Merstone Newport PO30 3BT "
QUESTA PSYCHOLOGICAL SERVICES LTD,12911052,Active,Private limited company,,,2020-09-28,,,86900,Exchange House St Cross Lane Newport PO30 5BZ England
DOWNSIDE HOUSE LIMITED,04565705,Active,Private limited company,,,2002-10-17,,,87300,"Downside House 3-4 St Boniface Road Ventnor PO38 1PJ "
JORDEN VALLEY ESTATES LIMITED,09928863,Active,Private limited company,,,2015-12-23,,,99999,16 Quay Street Newport PO30 5BG United Kingdom
PAULANGE LTD,11546320,Active,Private limited company,,,2018-08-31,,,86102,"Flat 5 Western House, Parkhurst Road, Newport Isle Flat 5 Western House Parkhurst Road Newpport PO30 5TG United Kingdom"
ALPHA OMEGA INFRASTRUCTURE LIMITED,16057901,Active,Private limited company,,,2024-11-04,,,70229,2 Bridge Road Cowes Isle Of Wight PO31 7PB United Kingdom
VECTIS STORAGE LIMITED,04114791,Active,Private limited company,,,2000-11-27,,,68320,"Osborne Stable Block York Avenue East Cowes PO32 6QY "
COVE SHOP LTD,08981376,Active,Private limited company,,,2014-04-07,,,47190,1 Langley Court Pyle Street Newport PO30 1LA United Kingdom
WEST BAY CONSTRUCTION AND DEVELOPMENT COMPANY LIMITED,06855323,Active,Private limited company,,,2009-03-23,,,82990,"9 St Johns Place Newport PO30 1LH "
WEST BAY CLUB LIMITED,06855265,Active,Private limited company,,,2009-03-23,,,82990,"9 St Johns Place Newport PO30 1LH "
WELD SERVICES (I W) LIMITED,07987820,Active,Private limited company,,,2012-03-13,,,33150,Attrills Boat Yard The Duver St. Helens Ryde PO33 1YB England
WEST BAY HOLDINGS LIMITED,06855333,Active,Private limited company,,,2009-03-23,,,82990,"9 St Johns Place Newport PO30 1LH "
NORRIS FAMILY GROCERS LIMITED,02696433,Active,Private limited company,,,1992-03-12,,,74990,Norris Family Grocers Newport Road Niton Ventnor PO38 2DB England
ISLAND CLEAN LTD,13972597,Active,Private limited company,,,2022-03-12,,,81221,57 Victoria Grove East Cowes PO32 6DL England
STAGEGEAR SALES LTD,16119266,Active,Private limited company,,,2024-12-04,,,47430,Stagegear Prospect Road Cowes PO31 7AD United Kingdom
FORD STRATEGIC PARTNERS LTD,05414894,Active,Private limited company,,,2005-04-06,,,70229,Vision Accounting Cothey Way Ryde PO33 1QT England
BEMBRIDGE HARBOUR IMPROVEMENTS COMPANY LIMITED,00743063,Active,Private limited company,,,1962-12-05,,,93290,"Duver Boat Yard The Duver St. Helens Ryde PO33 1YB "
D W A PROPERTY SOLUTIONS LIMITED,14756002,Active,Private limited company,,,2023-03-24,,,64209,1 Langley Court Pyle Street Newport PO30 1LA England
FLOOR IT IOW LTD,13345465,Active,Private limited company,,,2021-04-19,,,43330,54 Castle Road Newport PO30 1DP England
PHONEBOSS NEWPORT LTD,14530817,Active,Private limited company,,,2022-12-08,,,47421,50 High Street Newport PO30 1SB United Kingdom
WYNDHAM HOUSE MANAGEMENT COMPANY LIMITED,09689210,Active,Private limited company,,,2015-07-16,,,98000,Flat 3 Wyndham House 10 Melville Street Ryde PO33 2AE United Kingdom
NELSON HOUSE (RYDE) MANAGEMENT COMPANY LIMITED,06055760,Active,Private limited company,,,2007-01-17,,,98000,8 Gunville Road Newport PO30 5LB England
RUSSELLTHOMSON LTD,08829484,Active,Private limited company,,,2014-01-02,,,43220,13 Daish Way Newport PO30 5XJ England
PRIMARY HOUSES MANAGEMENT LIMITED(THE),01736377,Active,Private limited company,,,1983-07-04,,,98000 99999,The Estate Office Beatrice Avenue East Cowes PO32 6LW England
AWDEV LTD,12620690,Active,Private limited company,,,2020-05-26,,,46520,Unit 2 Chain Lane Newport PO30 5QA England
APPLEY MANAGEMENT LIMITED,06496203,Active,Private limited company,,,2008-02-07,,,98000,"The Estate Office Church Mews Beatrice Avenue East Cowes PO32 6LW "
IN SAFE HANDS HOME CARE LIMITED,07521487,Active,Private limited company,,,2011-02-08,,,68209,"Bluebell House Residential Care Home 74-76 Mitchell Avenue Ventnor PO38 1DS "
DW PROJECT SOLUTIONS LIMITED,08866419,Active,Private limited company,,,2014-01-29,,,74909,Arnold House 2 New Road Brading Sandown PO36 0DT England
CAZBAA LTD,07734405,Active,Private limited company,,,2011-08-09,,,70229,"Olive Cottage Carpenters Road St. Helens Ryde PO33 1YQ "
HEDLEY COURT (IOW) RESIDENTS ASSOCIATION LIMITED,16256401,Active,Private limited by guarantee without share capital,,,2025-02-17,,,98000,"Flat 6 Hedley Court 74 Victoria Avenue Shanklin PO37 6LY "
TUDOR HOUSE RESIDENTS COMPANY (COWES) LIMITED,01484131,Active,Private limited company,,,1980-03-10,,,98000,"The Estate Office Church Mews Beatrice Avenue Whippingham PO32 6LW "
AC ELECTRICAL CONTRACTORS IW LTD,15231288,Active,Private limited company,,,2023-10-24,,,43210,5 Holyrood Street Newport PO30 5AU United Kingdom
BRITT FORM A LTD,12460186,Active,Private limited company,,,2020-02-13,,,82990,Flat 3 5 Carisbrooke Road Newport PO30 1BJ England
SOUTHERN COFFEE LTD,13210015,Active,Private limited company,,,2021-02-18,,,47190,Southern Coffee Unit 1c Golden Hill Park Golden Hill Park Unit 1c Freshwater PO40 9UJ United Kingdom
TL ELECTRICAL (IOW) LTD,08886372,Active,Private limited company,,,2014-02-11,,,43210,Unit 1 21 Whitcombe Road Carisbrooke Business Estate Newport PO30 1YS England
HOMEPAGE MEDIA LIMITED,04448130,Active,Private limited company,,,2002-05-27,,,62012 62090,"Old Yafford Farm Mill Lane Yafford Newport PO30 3LH "
SAILFISH MARINE (ISLE OF WIGHT) LTD,14743045,Active,Private limited company,,,2023-03-20,,,28131,"Flat 1, 12 The Strand Ryde PO33 1JE England"
BEECH PARK CONSULTANCY LIMITED,11847293,Active,Private limited company,,,2019-02-26,,,70229,80 Granville Road Cowes PO31 7JF United Kingdom
GEORGE JENKINS TRANSPORT LIMITED,02161662,Active,Private limited company,,,1987-09-07,,,49410,"Bigbury Farm Alverstone Road Sandown PO36 0LH "
BEAULIEU MARINE DEVELOPMENT LIMITED,02423660,Active,Private limited company,,,1989-09-18,,,74100,Jubilee Villa Tennyson Road Yarmouth PO41 0QN England
KINGSWELL HEAVY HAULAGE LIMITED,09513578,Active,Private limited company,,,2015-03-27,,,49410,The Workshops Ashengrove Farm Calbourne Newport PO30 4HU United Kingdom
AVILEC LIMITED,04373853,Active,Private limited company,,,2002-02-14,,,45200,Whitegates Building Medina Yard Arctic Road Cowes PO31 7PG United Kingdom
ROBERT GRAY DESIGN LTD,04639521,Active,Private limited company,,,2003-01-16,,,71129,"12 Donnington Drive Shanklin PO37 7JA "
MYSTICAL SOUL SANCTUARY LTD.,15325872,Active,Private limited company,,,2023-12-04,,,85600 96040,26 Ashey Road Ryde PO33 2UW United Kingdom
ISLAND FINE ARTS LIMITED,04431546,Active,Private limited company,,,2002-05-03,,,47781,East Quay Kite Hill Wootton Bridge PO33 4LA England
STONE CRABS PRODUCTIONS,04693145,Active,"Private Limited Company by guarantee without share capital, use of 'Limited' exemption",,,2003-03-11,,,90010,26 Albert Road Shanklin PO37 7NS England
WIGHT FIRE TRAINING LTD,06775285,Active,Private limited company,,,2008-12-17,,,85600,"3 Hornbeam Square Bullen Village Ryde PO33 1RF "
NORTON RESIDENTIAL LIMITED,07866383,Active,Private limited company,,,2011-11-30,,,41100,"9 St Johns Place Newport PO30 1LH "
GENIE LETTINGS LIMITED,11717819,Active,Private limited company,,,2018-12-07,,,68310,Exchange House St Cross Lane Newport PO30 5BZ England
EV CONNEXTIONS LTD,11035311,Active,Private limited company,,,2017-10-27,,,43210,15 Brookfield Gardens Ryde PO33 3NP England
P WOODFORD LIMITED,06071843,Active,Private limited company,,,2007-01-29,,,43390,39 High Street Shanklin PO37 6JJ England
BRIAREUS SECURITIES,00931082,Active,Private unlimited company,,,1968-04-25,,,68100,"Sainham House Godshill Isle Of Wight PO38 3JS "
RLW ENGINEERING LTD,10385910,Active,Private limited company,,,2016-09-20,,,30110,Hill Farm Hill Top Newchurch Sandown PO36 0NU England
AMW CARPENTRY & INSTALLATIONS LTD,11840544,Active,Private limited company,,,2019-02-21,,,43320,52 Wellington Road Binstead Ryde PO33 3QR United Kingdom
CITI FINANCIALS LTD,07227253,Active,Private limited company,,,2010-04-19,,,63990,"71-73 St James Street Newport PO30 1LQ "
STITCH DEPARTMENT CIC,13775636,Active,Private limited by guarantee without share capital,Community Interest Company (CIC),,2021-12-01,,,14190 47710 96090,29-30 Cross Street Ryde PO33 2AA United Kingdom
ANOTHER WAY ROUND LTD,09915266,Active,Private limited company,,,2015-12-14,,,85600,Vision Accounting Fortis House Cothey Way Ryde PO33 1QT England
AVERRUNCUS SOLUTIONS LTD,15259644,Active,Private limited company,,,2023-11-03,,,70229,Greatwood Lodge Cowleaze Hill Shanklin PO37 6RB United Kingdom
COMPOSITE CRAFT LIMITED,04802835,Active,Private limited company,,,2003-06-18,,,30120,65 Newport Road Cowes PO31 7PN England
HARWOODS (ISLE OF WIGHT) LIMITED,07890383,Active,Private limited company,,,2011-12-22,,,99999,"Lushington Garage Lushington Hill Wootton Bridge, Ryde Isle Of Wight PO33 4RH "
CHRISTOPHER JELF LIMITED,10832909,Active,Private limited company,,,2017-06-23,,,74202,Vision Accounting Fortis House Cothey Way Ryde PO33 1QT England
R H TAYLOR (PERRETON) LIMITED,00386625,Active,Private limited company,,,1944-03-31,,,01450,"Perreton Farm Budbridge Lane, Merstone Newport PO30 3DL "
PROACTIVE HR LTD,04070235,Active,Private limited company,,,2000-09-12,,,70229,"St. Vincent Ferrer Ashknowle Lane Whitwell PO38 2PP "
DAVID BUCKERIDGE INVESTIGATIONS LIMITED,05883383,Active,Private limited company,,,2006-07-21,,,01500 68209 70229,"Yaverland Manor Farm Yaverland Road Sandown PO36 8QW "
WIGHT EXPEDITIONS LTD,14413995,Active,Private limited company,,,2022-10-12,,,93199,42 Church Road Cowes PO31 8JH United Kingdom
PHOENIX FLOORING PROJECTS LIMITED,11071621,Active,Private limited company,,,2017-11-20,,,43330,East Quay Kite Hill Wootton Bridge PO33 4LA United Kingdom
NVRJ MASONS LIMITED,13523322,Active,Private limited company,,,2021-07-21,,,56102,6-8 Town Lane Newport PO30 1JU England
VECTIS 741 LIMITED,07971202,Liquidation,Private limited company,,,2012-03-01,,,62020,Arnold House 2 New Road Brading Sandown PO36 0DT England
1 HEYFORD TERRACE (FREEHOLD) LIMITED,11113714,Active,Private limited by guarantee without share capital,,,2017-12-15,,,98000,1 Langley Court Pyle Street Newport PO30 1LA United Kingdom
ISLAND BOOK-KEEPING BUREAU LIMITED,03018160,Active,Private limited company,,,1995-02-03,,,64999,"8 Cherrywood View Arreton Newport PO30 3AY "
I TO I RESEARCH LIMITED,04318770,Active,Private limited company,,,2001-11-07,,,73200,St Catherine's House St Catherine's Road Niton PO38 2NA United Kingdom
SCINDE COURT MANAGEMENT COMPANY LIMITED,02305310,Active,Private limited company,,,1988-10-13,,,98000,30 Chatfield Lodge Newport PO30 1XR England
T.M. TAYLOR & SONS LIMITED,02762326,Active,Private limited company,,,1992-11-05,,,96090,"Exchange House St Cross Lane Newport PO30 5BZ "
ESCAPE @ TAKE 2 LIMITED,04616735,Active,Private limited company,,,2002-12-13,,,96020,East Quay Kite Hill Wootton Bridge PO33 4LA United Kingdom
RIVERSIDE VENTURES (ISLE OF WIGHT) LIMITED,03513635,Active,Private limited company,,,1998-02-19,,,96090,"The Riverside Centre The Quay Newport PO30 2QR "
LEADLINE MARKETING IOW LTD,16124780,Active,Private limited company,,,2024-12-09,,,82200,Innovation Centre St Cross Business Park Monks Brook Newport PO30 5WB England
THE EXCHANGE VINYL LTD,09341190,Active,Private limited company,,,2014-12-04,,,32990,C/O Apple Accountancy 5 Holyrood Street Newport PO30 5AU United Kingdom
BUDBRIDGE ESTATES LIMITED,07957588,Active,Private limited company,,,2012-02-21,,,41100 41202 43999,"The Office Great Budbridge Manor Merstone Newport PO30 3DH "
SHANKLIN THEATRE LIMITED,07198169,Active,Private limited company,,,2010-03-22,,,90040,"Shanklin Theatre Steephill Road Shanklin PO37 6AJ "
RADIX NUTRITION LIMITED,05423455,Active,Private limited company,,,2005-04-13,,,46170 46760 47910 72190,Grey Gables Church Hill Godshill PO38 3HY England
SUM OF THE PARTS LIMITED,03945381,Active,Private limited company,,,2000-03-10,,,74990,East Quay Kite Hill Wootton Bridge PO33 4LA England
KITOVA & JOHN LTD,12309531,Active,Private limited company,,,2019-11-12,,,86210,16c Sandown Road Lake PO36 9JP England
ISLAND COMMUNITY VENTURES LIMITED,07474562,Active,Private limited company,,,2010-12-21,,,47110,"Riverside Centre The Quay Newport PO30 2QR "
ARC BIODIVERSITY AND CLIMATE LTD,08823037,Active,Private limited company,,,2013-12-20,,,74901,The Bunker Browns Golf Course Culver Parade Sandown PO36 8QA England
A CONTROL LIMITED,03945484,Active,Private limited company,,,2000-03-10,,,62090,03945484 Priory Road Downdale Lodge Shanklin PO37 6SA England
MS FRIDAY ACCOUNTANCY SERVICES LTD,11288513,Active,Private limited company,,,2018-04-03,,,69202,Onward Business Hub College Close Sandown PO36 8EB England
JMH PUBLICATIONS LIMITED,05403437,Active,Private limited company,,,2005-03-24,,,58290,"33 Hillrise Avenue Binstead Ryde PO33 3TZ "
THE PHOENIX PROJECT (IOW),07508521,Active,"Private Limited Company by guarantee without share capital, use of 'Limited' exemption",,,2011-01-27,,,88100,"The Phoenix Centre 36 Salters Road Haylands Ryde PO33 3HU "
THE LIMES RESIDENTIAL CARE HOME LIMITED,08302090,Active,Private limited company,,,2012-11-21,,,87300,"43 Foreland Road Bembridge PO35 5XN "
KCHR ISLE OF WIGHT LTD,12113150,Active,Private limited company,,,2019-07-19,,,78300,47 Bellevue Road Cowes PO31 7HJ United Kingdom
CHALLEN BUILDING & RENOVATIONS LIMITED,05068183,Active,Private limited company,,,2004-03-09,,,43210,"Vision Accounting, Fortis House Cothey Way Ryde PO33 1QT England"
PEEKABOO LIMITED,08329592,Active,Private limited company,,,2012-12-13,,,73110,"Unit 1 Enterprise Court Nicholson Road Ryde PO33 1BD "
ISLE OF WIGHT GLASS MUSEUM LTD.,09492023,Active,Private limited company,,,2015-03-16,,,91020,39 Edinburgh Road Freshwater PO40 9DN England
CAROLYN DE LA DRAPIERE LIMITED,04465557,Active,Private limited company,,,2002-06-20,,,14132,C/O Isle Of Wight Accountants Cemoc House Rectory Drive Wootton Bridge PO33 4QQ England
APS PLUMBING AND HEATING LIMITED,04732760,Active,Private limited company,,,2003-04-13,,,43220,1 Upton Cottages Stroud Wood Road Ryde PO33 4BX England
THE COURTYARD AESTHETIC CLINIC LIMITED,12511639,Active,Private limited company,,,2020-03-11,,,82990,5 The Courtyard St Cross Business Park Newport PO30 5BF England
SIFFCO LIMITED,06244158,Active,Private limited company,,,2007-05-11,,,49410,"Avalon Appley Rise Ryde PO33 1LE "
HOME CONSULTANCY LTD,07630836,Active,Private limited company,,,2011-05-11,,,70229,"6 Ratcliffe Avenue Ryde PO33 3DN "
COMMUNITY ACTION ISLE OF WIGHT,03340032,Active,"Private Limited Company by guarantee without share capital, use of 'Limited' exemption",,,1997-03-25,,,82990,"Riverside Centre The Quay Newport PO30 2QR "
ROEBECK COUNTRY PARK LTD,09282091,Active,Private limited company,,,2014-10-27,,,68209,Spinnakers Main Road Bouldnor Yarmouth PO41 0UR England
FARNEY LIMITED,07871680,Active,Private limited company,,,2011-12-05,,,68209,60 - 66 Lugley Street Newport PO30 5EU England
ARTHUR WHEELER ESTATE AGENTS LIMITED,04710182,Active,Private limited company,,,2003-03-25,,,68310,"46 Regent Street Shanklin Isle Of Wight PO37 7AA "
CLIFFORD J. MATTHEWS LIMITED,02208052,Active,Private limited company,,,1987-12-23,,,02100 02200,"Hornbeam House Castlehaven Lane Niton Undercliff Ventnor PO38 2NB "
G C ENGINEERING (ISLE OF WIGHT) LTD,04493140,Active,Private limited company,,,2002-07-23,,,25620,"4 Marlbrough Close Ryde P033 1AP "
OAKRAY CARE (BROADHURST) LIMITED,10665925,Active,Private limited company,,,2017-03-13,,,87300,East Quay Kite Hill Wootton Bridge PO33 4LA England
OAKRAY CARE (FAIRHAVEN) LIMITED,10665635,Active,Private limited company,,,2017-03-13,,,87300,East Quay Kite Hill Wootton Bridge PO33 4LA England
OAKRAY CARE GROUP LIMITED,10663104,Active,Private limited company,,,2017-03-10,,,68209 68320 87300,East Quay Kite Hill Wootton Bridge PO33 4LA England
JVP LETTINGS LTD,14703848,Active,Private limited company,,,2023-03-03,,,68209,17 Cliff Path Lake Sandown Isle Of Wight PO36 8PL United Kingdom
DINOSAUR EXPEDITIONS C.I.C.,08451872,Active,Private limited company,Community Interest Company (CIC),,2013-03-19,,,79901 90030 91020,"Dinosaur Farm Military Road Brighstone Newport PO30 4PG "
LANE END BEACH HUTS LIMITED,03670995,Active,Private limited company,,,1998-11-20,,,74990,Steephill Chambers 3 Steephill Road Shanklin PO37 6AB England
FALCONIOW LTD,14753384,Active,Private limited company,,,2023-03-23,,,56102,45 School Green Road Freshwater Isle Of Wight PO40 9AS England
R C  ORCHARD LIMITED,06007672,Active,Private limited company,,,2006-11-23,,,71111,"18 Fernside Way Wootton Isle Of Wight PO33 4QT "
MACKENZIE - KINMONT LIMITED,02521990,Active,Private limited company,,,1990-07-13,,,68320 82302 82990,"Tara House Luton Lane 437 Newport Road Northwood PO31 8PS "
