company_name,company_number,company_status,company_type,company_subtype,dissolution_date,incorporation_date,removed_date,registered_date,nature_of_business,registered_office_address
TEN.TWO GLOBAL LTD,13872110,Active,Private limited company,,,2022-01-26,,,68100 68209 68320 93199,"87a Lushington Hill Wootton Bridge, Ryde Isle Of Wight PO33 4NR United Kingdom"
CERAMIC SUBSTRATES & COMPONENTS LIMITED,00934853,Active,Private limited company,,,1968-07-03,,,23490,Exchange House St Cross Lane Newport PO30 5BZ United Kingdom
K K PROPERTIES ISLE OF WIGHT LIMITED,13367642,Active,Private limited company,,,2021-04-29,,,68209,54 Springtide 54 Fishbourne Lane Ryde PO33 4EX England
JMP PARTNERSHIP (IW) LTD,06759973,Active,Private limited company,,,2008-11-27,,,41100,"Exchange House St. Cross Lane Newport PO30 5BZ "
DROMARTI LIMITED,07184250,Active,Private limited company,,,2010-03-10,,,46420 47910,Shishford Cottage Caulbourne Lane Newbridge Yarmouth PO41 0TZ England
GGS IOW LIMITED,13015316,Active,Private limited company,,,2020-11-13,,,56101,Island Riding Centre Staplers Road Newport PO30 2NB United Kingdom
KINGSLEA MANAGEMENT CO. LIMITED,03268617,Active,Private limited company,,,1996-10-24,,,98000,"8 Gunville Road Newport PO30 5LB "
KAY GOWER LTD,13858529,Active,Private limited company,,,2022-01-19,,,96020,"Unit 4, Isle Of Wight Pearl Military Road Brighstone Newport PO30 4DD England"
BELLISSIMA (IOW) LIMITED,07491268,Active,Private limited company,,,2011-01-13,,,47721,"C/O A H Cross & Co 16 Quay Street Newport PO30 5BG "
JO RICHARDS DESIGN LIMITED,03259007,Active,Private limited company,,,1996-10-04,,,96090,"3 Garfield Road Ryde Isle Of Wight PO33 2PS "
CLARENDON COURT (VENTNOR) LIMITED,05979722,Active,Private limited by guarantee without share capital,,,2006-10-26,,,98000,"8 Gunville Road Newport PO30 5LB "
JJC MANAGEMENT (IOW) LIMITED,08878734,Active,Private limited company,,,2014-02-06,,,68209,"16 Quay Street Newport PO30 5BG "
COBALT AEROSPACE LIMITED,08435365,Active,Private limited company,,,2013-03-07,,,74909,Ifpl Elm Lane Calbourne Newport PO30 4JY England
EDDINGTON FIELD LIMITED,09253796,Active,Private limited company,,,2014-10-08,,,98000,"Duver House Duver Road St. Helens Ryde PO33 1XY "
ISLAND RIDING CENTRE LIMITED,09801472,Active,Private limited company,,,2015-09-30,,,68100,Aisthorpe Farm Staplers Road Newport PO30 2NB England
GURIT (UK) LIMITED,01368806,Active,Private limited company,,,1978-05-16,,,32990,"St Cross Business Park Newport Isle Of Wight PO30 5WU "
GROUND LEVEL TRADING LTD,14876768,Active,Private limited company,,,2023-05-17,,,47290 56101 56102,The Loft@Granary Court 128 Pyle Street Newport Isle Of Wight PO30 1JW United Kingdom
YARMOUTH (IOW) LTD,16011688,Active,Private limited company,,,2024-10-10,,,47110,"Yarmouth Deli, The Square Yarmouth PO41 0NS United Kingdom"
MONTAGU HOUSE (ISLE OF WIGHT) LIMITED,04083186,Active,Private limited company,,,2000-10-04,,,98000,"The Estate Office Church Mews Beatrice Avenue Whippingham East Cowes PO32 6LW "
THE RAVENS MANAGEMENT COMPANY LIMITED,04559145,Active,Private limited company,,,2002-10-10,,,98000,The Estate Office Beatrice Avenue East Cowes PO32 6LW England
BURNS BLADE REPAIR SERVICES LTD,15184503,Active,Private limited company,,,2023-10-03,,,28110,Flat 8 Higginson House 20 Newport Road Cowes PO31 7GD United Kingdom
THE JULIA MARGARET CAMERON TRUST,02800174,Active,"Private Limited Company by guarantee without share capital, use of 'Limited' exemption",,,1993-03-16,,,91020,"Dimbola Museum And Galleries Terrace Lane Freshwater Bay PO40 9QE "
BERNARD OLESINSKI LIMITED,01000501,Active,Private limited company,,,1971-01-22,,,71111 71121,"16 Quay Street Newport Isle Of Wight PO30 5BG "
DATASWIFT NETWORK SERVICES LIMITED,04225974,Active,Private limited company,,,2001-05-31,,,61100 61200 61900 62020,Unit 4 Wootton Business Park Whiterails Road Wootton Bridge PO33 4RH England
MADGWICK PARK MANAGEMENT COMPANY LIMITED,11758746,Active,Private limited by guarantee without share capital,,,2019-01-09,,,98000,128 Pyle Street Newport PO30 1JW England
GUY WHITEHOUSE YACHT DESIGN LIMITED,05247950,Active,Private limited company,,,2004-10-01,,,71111,38 Britannia Way East Cowes PO32 6DQ England
HANOVER BARN (ISLE OF WIGHT) LIMITED,00636033,Active,Private limited company,,,1959-08-28,,,82990,"Limerstone Farm Linerstone Newport PO30 4AB "
R J COOK LIMITED,05291467,Active,Private limited company,,,2004-11-19,,,42990,"Red Cottage Brook Green Brook Newport PO30 4HA "
DP FINANCIAL MARKETING LIMITED,05243715,Active,Private limited company,,,2004-09-28,,,64999,"Exchange House St. Cross Lane Newport PO30 5BZ "
EMPATHY CARE (IOW) LTD,10999648,Active,Private limited company,,,2017-10-06,,,87100,East Quay Kite Hill Wootton Bridge PO33 4LA United Kingdom
TMFC SOLUTIONS LIMITED,08877138,Active,Private limited company,,,2014-02-05,,,53100,Cavendish Court 56 Melville Street Sandown PO36 8LF England
YATES IOW BREWERY LIMITED,05412307,Active,Private limited company,,,2005-04-04,,,11050 46342,"Unit 4 Langbridge Business Centre Newchurch Sandown PO36 0NP "
SAMARA INNS LTD,12839503,Active,Private limited company,,,2020-08-26,,,55100,C/O Isle Of Wight Accountants Cemoc House Rectory Drive Wootton Bridge PO33 4QQ England
LOAPH LIMITED,15167709,Active,Private limited company,,,2023-09-27,,,56102,Loaph Church Hollow Godshill PO38 3HH United Kingdom
PRIORY ASSET INVESTMENT LTD,11800648,Active,Private limited company,,,2019-01-31,,,43290,Uk Office Marinus Medina Road Cowes PO31 7XF England
PCI INVESTMENT LTD,11800649,Active,Private limited company,,,2019-01-31,,,43290,Uk Office Marinus Medina Road Cowes PO31 7XF England
COWES AND WEST WIGHT HEARING CARE LIMITED,15804336,Active,Private limited company,,,2024-06-26,,,47741,Alzheimer's Cafe Park Road Cowes PO31 7LZ England
ISLAND PEOPLE LTD,13669938,Active,Private limited company,,,2021-10-08,,,78200,"Devonshire House, 66 Broadway Sandown PO36 9BD England"
ISLAND IDENTITY CIC,12424168,Active,Private limited by guarantee without share capital,Community Interest Company (CIC),,2020-01-24,,,73110 79901,"Unit J The Garlic Farm Office , Langbridge Business Park Sandown PO36 0NP United Kingdom"
SABAH ENGINEERING LIMITED,03865448,Active,Private limited company,,,1999-10-26,,,68209,East Quay Kite Hill Wootton Bridge PO33 4LA England
MANUAL WORKS LTD,16037923,Active,Private limited company,,,2024-10-23,,,73110,Braxton Mews Halletts Shute Yarmouth PO41 0RH United Kingdom
32 ST. THOMAS' STREET RYDE MANAGEMENT COMPANY LIMITED,07512020,Active,Private limited company,,,2011-02-01,,,68320,9 St John's Place Newport Isle Of Wight PO30 1LH United Kingdom
ORCHID COURT MANAGEMENT COMPANY (IW) LIMITED,11031618,Active,Private limited by guarantee without share capital,,,2017-10-25,,,98000,"The Estate Office Church Mews Whippingham East Cowes PO32 6LW "
WOODLAND AMENITIES (ROGERSTONE) LIMITED,01433589,Active,Private limited company,,,1979-06-28,,,99999,38 New Barn Road East Cowes PO32 6AY England
ST ANDREWS COURT (LAKE) LIMITED,06409012,Active,Private limited by guarantee without share capital,,,2007-10-25,,,98000,"8 Gunville Road Newport PO30 5LB "
EURYNET LIMITED,03973643,Active,Private limited company,,,2000-04-14,,,62020,"16 York Road Sandown PO36 8ET "
NEW FERNLEIGH COMPANY LIMITED,07874911,Active,Private limited company,,,2011-12-08,,,98000,"16 Quay Street Newport PO30 5BG "
SAXONBURY HOUSE MANAGEMENT COMPANY LIMITED,03026186,Active,Private limited company,,,1995-02-24,,,66300,Flat 3 Saxonbury House 94 West Street Ryde PO33 2NX England
ANDERSON BOAT CRUISES LIMITED,09568403,Active,Private limited company,,,2015-04-30,,,50100,4 Wellington Square Heytesbury Road Yarmouth PO41 0LB England
7-7A QUEENS ROAD MANAGEMENT LIMITED,06819071,Active,Private limited company,,,2009-02-13,,,55900,"7 Queens Road Shanklin PO37 6AN "
NOVA VITIS LTD,16039798,Active,Private limited company,,,2024-10-24,,,73110,48 Castle Road Newport PO30 1DP United Kingdom
MILL STREET (IOW) RESIDENTS LIMITED,07923678,Active,Private limited by guarantee without share capital,,,2012-01-25,,,98000,"30 Chatfield Lodge Newport PO30 1XR "
SANDELL PARTNERSHIP LTD,16040804,Active,Private limited company,,,2024-10-25,,,64209,1 Langley Court Pyle Street Newport PO30 1LA United Kingdom
NATUREZONES WILDLIFE EDUCATION TRUST,06408075,Active,"Private Limited Company by guarantee without share capital, use of 'Limited' exemption",,,2007-10-24,,,01300 85520,"Padmore Lodge, Beatrice Avenue East Cowes Isle Of Wight PO32 6LP "
ISLAND ESTATES LTD,15211325,Active,Private limited company,,,2023-10-13,,,41100,South Cottage Blackwater Road Newport PO30 3BE United Kingdom
JOHN PECK CONSTRUCTION LTD,04135726,Active,Private limited company,,,2001-01-04,,,41201,Unit 2 Pritchetts Way Rookley Ventnor PO38 3LT England
ELECTRIC AVENUE IOW LIMITED,15964657,Active,Private limited company,,,2024-09-18,,,43210,Office 4 Baring Chambers 13 Denmark Road Cowes PO31 7SY England
ILLOVY PROPERTY HOLDINGS LIMITED,06036021,Active,Private limited company,,,2006-12-21,,,70100,"9 Tides Reach Birmingham Road Cowes PO31 7NU "
SOLENT SHORES MANAGEMENT COMPANY LIMITED,09358016,Active,Private limited company,,,2014-12-17,,,70229,East Quay Kite Hill Wootton Bridge PO33 4LA United Kingdom
FILL IT AND CHIPS LTD,12816630,Active,Private limited company,,,2020-08-17,,,45200,7 Park Road Ryde PO33 2BQ England
HOLBROOK ARCHITECHTURAL SERVICES LIMITED,05521211,Active,Private limited company,,,2005-07-28,,,71129,"3 Garfield Road Ryde Isle Of Wight PO33 2PS "
BLACKHOUSE QUAY DEVELOPMENTS LIMITED,04335969,Active,Private limited company,,,2001-12-07,,,41100,"28 Osborne Heights East Cowes PO32 6FE "
MDX PROPERTY GROUP LIMITED,15966010,Active,Private limited company,,,2024-09-19,,,68100,Seascape Egypt Hill Cowes PO31 8BP England
PARADICE ICE CREAM PARLOUR LIMITED,11237166,Active,Private limited company,,,2018-03-06,,,47110,56 High Street Cowes PO31 7RR United Kingdom
SAY CARE LIMITED,05646496,Active,Private limited company,,,2005-12-06,,,88990,"8 Sunset Close Freshwater PO40 9JR "
REUSE REHOME RELOVE LIMITED,13092372,Active,Private limited company,,,2020-12-21,,,38110 47791 47799,Bellevue Binstead Hill Ryde PO33 3RL England
SANDOWN PROPERTY COMPANY LIMITED,05971714,Active,Private limited company,,,2006-10-18,,,98000,The Estate Office Beatrice Avenue Whippingham East Cowes PO32 6LW England
HERMANS & LUCK LIMITED,05643700,Active,Private limited company,,,2005-12-02,,,43390,"The Office Madeira Road Seaview PO34 5BA "
THE YARMOUTH BARBERS AND CONNOISSEURS LIMITED,12382287,Active,Private limited company,,,2020-01-02,,,56101,Jireh Place Jireh Place Market Square Yarmouth PO41 0NR England
M &C WELLBEING LTD,11127952,Active,Private limited company,,,2017-12-29,,,47910 86230 96090,3 Wychwood Close Seaview PO34 5JD England
BEACH HOUSE ART LTD.,13173565,Active,Private limited company,,,2021-02-02,,,58190,No 3 Four Cottages Whippingham Road East Cowes PO32 6NG England
COTSWOLD COURT (MANAGEMENT) COMPANY LIMITED,01045710,Active,Private limited company,,,1972-03-10,,,98000,"8 Gunville Road Newport PO30 5LB "
PERFORMANCE IN PEOPLE LIMITED,03871085,Active,Private limited company,,,1999-11-04,,,73200,The Observatory Cothey Way Westridge Business Park Ryde PO33 1FX England
COLLERAS OUGHTER LIMITED,08912806,Active,Private limited company,,,2014-02-26,,,46150,East Quay Kite Hill Wootton Bridge PO33 4LA England
RESPONSE SUPPORT LIMITED,07350057,Active,Private limited company,,,2010-08-18,,,70229,"Exchange House St. Cross Lane Newport PO30 5BZ "
SILICON DIGITAL GROUP LTD,11981951,Active,Private limited company,,,2019-05-07,,,58210 63110,First Floor 4-5 St James Street Newport PO30 5HE England
LESLIES (VENTNOR) LIMITED,00434113,Active,Private limited company,,,1947-04-29,,,45111 45112 45200 77110,"Northwood Garage, 341 To 351 Newport Road,  Cowes Isle Of Wight PO31 8PG "
AIRTEK SERVICES IOW LIMITED,08990219,Active,Private limited company,,,2014-04-10,,,33200,Vision Accounting Fortis House Cothey Way Ryde PO33 1QT United Kingdom
THE PAVILIONS MANAGEMENT COMPANY (SOUTHAMPTON) LIMITED,10532307,Active,Private limited by guarantee without share capital,,,2016-12-19,,,98000,Ermc 128 Pyle Street Granary Court Newport PO30 1JW United Kingdom
CLOUD CHOICES LTD,12413954,Active,Private limited company,,,2020-01-20,,,62020,Kernswald Warden Road Totland Bay PO39 0AD England
WEST WIGHT MINI SKIPS LIMITED,04537017,Active,Private limited company,,,2002-09-17,,,38110,Arnold House 2 New Road Brading Sandown PO36 0DT England
ZODIAC DESIGN AND FILMS LIMITED,03699541,Active,Private limited company,,,1999-01-22,,,43390,2 New Road Brading Sandown PO36 0DT England
ISLAND TOURIST PRODUCTS LIMITED,04537787,Active,Private limited company,,,2002-09-17,,,58110,28 Hendy Road East Cowes PO32 6QQ United Kingdom
CLIFF INVESTMENT PROPERTIES LIMITED,03160518,Active,Private limited company,,,1996-02-16,,,99999,"Flat 6 Cliff House Bonchurch Shute Ventnor PO38 1NU "
NETDREAMS WEB DESIGN LTD,14571328,Active,Private limited company,,,2023-01-05,,,62090,"The Prince Consort, Penthouse Flat St. Thomas Street Ryde PO33 2DL United Kingdom"
LIFELINE ALARM SYSTEMS LIMITED,02491672,Active,Private limited company,,,1990-04-11,,,80200,"The Island Security Centre Riverway Newport PO30 5UX "
SUTHERLAND LODGE MANAGEMENT COMPANY LIMITED,03126565,Active,Private limited company,,,1995-11-15,,,98000 99999,"The Estate Office Beatrice Avenue East Cowes PO32 6LW "
PRICES MOT CENTRE LIMITED,06096104,Active,Private limited company,,,2007-02-12,,,74990,East Quay Kite Hill Wootton Bridge PO33 4LA United Kingdom
QUINTA COTTAGES LIMITED,04891337,Active,Private limited company,,,2003-09-08,,,52101,"Kings Manor Freshwater Isle Of Wight PO40 9TL "
TYLER ROBERTS (IOW) LIMITED,05569104,Active,Private limited company,,,2005-09-20,,,43330 43341,"2 Valley Farm Cottages Rew Lane Ventnor PO38 3AX "
ABBEYFIELD RYDE SOCIETY LIMITED(THE),00862661,Active,Private limited by guarantee without share capital,,,1965-10-28,,,87300,"Abbeyfield House 2 Queens Road Ryde Isle Of Wight PO33 3BG "
JONATHAN BETHEL DESIGN LIMITED,13158309,Active,Private limited company,,,2021-01-26,,,71111,1 Langley Court Pyle Street Newport PO30 1LA United Kingdom
WOOTTON TYRES LTD,05335781,Active,Private limited company,,,2005-01-18,,,45320,"Unit 9, Wootton Business Park Whiterails Road Wootton Ryde PO33 4RH England"
HAMILTONS EVENT MANAGEMENT LIMITED,03620361,Active,Private limited company,,,1998-08-24,,,82990,"2e Cross Street Oakfield Ryde Isle Of Wight PO33 1EH "
THE PIANO CAFE (IOW) LTD,13409231,Active,Private limited company,,,2021-05-19,,,56101,East Quay Kite Hill Wootton Bridge Ryde PO33 4LA England
TANZELL LIMITED,06491827,Active,Private limited company,,,2008-02-04,,,70229,"Brook House Park Avenue Ventnor PO38 1LE "
COSÃN CRÃ“GA LTD,12178405,Active,Private limited company,,,2019-08-28,,,78300,2 Harrow Cottages Nettlestone Hill Seaview PO34 5DU United Kingdom
ISLE PAINT AND MAINTAIN LIMITED,06443170,Active,Private limited company,,,2007-12-03,,,43330,"3 Coniston Avenue Ryde PO33 3SB "
EASTCLIFF COURT (PHASE 2) MANAGEMENT COMPANY LIMITED,02749000,Active,Private limited company,,,1992-09-21,,,98000,"8 Gunville Road Newport PO30 5LB "
33 MEDIA PRODUCTIONS LTD,15148742,Active,Private limited company,,,2023-09-19,,,59200,6 Wellington Square Heytesbury Road Yarmouth PO41 0LB United Kingdom
GATEHOUSE DEVELOPMENTS (IOW) LIMITED,06377665,Active,Private limited company,,,2007-09-21,,,41100,Starboard 4 The Ruskins Kings Road Bembridge PO35 5NY England
PTP LONDON LIMITED,15150465,Active,Private limited company,,,2023-09-20,,,90030,"Suite 17, Mill Court Furrlongs Newport PO30 2AA England"
FIFTY DEGREES NORTH CONSULTING LIMITED,10377668,Active,Private limited company,,,2016-09-15,,,62020,Exchange House St Cross Lane Newport PO30 5BZ England
THE PORT AND BARREL LIMITED,11698284,Active,Private limited company,,,2018-11-27,,,56101,Exchange House St. Cross Lane Newport PO30 5BZ United Kingdom
W.J.NIGH & SONS LIMITED,00347920,Active,Private limited company,,,1938-12-31,,,46760,"1 Station Approach Shanklin PO37 7HX "
CAYLON LIMITED,11725379,Active,Private limited company,,,2018-12-13,,,70229,9 St John's Place Newport Isle Of Wight PO30 1LH United Kingdom
LAIKIPIA LIMITED,08686490,Active,Private limited company,,,2013-09-11,,,68209,East Quay Kite Hill Wootton Bridge PO33 4LA England
JUDD RESIDENTIAL LETTINGS LTD,11571112,Active,Private limited company,,,2018-09-17,,,68209,16c Sandown Road Lake PO36 9JP England
FORELAND HOMES LTD,13233734,Active,Private limited company,,,2021-02-27,,,41100,Holbrook House 11 Forelands Field Road Bembridge PO35 5TP England
GL DEVELOPMENTS IOW LTD,13236815,Active,Private limited company,,,2021-03-01,,,41100,Holbrook House 11 Forelands Field Road Bembridge PO35 5TP England
SKYLINE CARPENTRY LIMITED,10576721,Active,Private limited company,,,2017-01-23,,,16230,1 Langley Court Pyle Street Newport PO30 1LA England
MARINE DETAIL IOW LIMITED,14117122,Active,Private limited company,,,2022-05-19,,,33150,Unit 2 Kingston Boatyard Kingston Road East Cowes PO32 6JS England
EURECO LIMITED,03139018,Active,Private limited company,,,1995-12-18,,,62020 63120 74100,"2 Puckpool Hill Ryde PO33 1PJ "
BAILEY FINCH ASSOCIATES LIMITED,06156706,Active,Private limited company,,,2007-03-13,,,78109,"328 Park Road Cowes PO31 7NN "
LYNCROFT MANAGEMENT LIMITED,02380307,Active,Private limited company,,,1989-05-05,,,98000,30 Chatfield Lodge Newport PO30 1XR England
CROSS STREET MANAGEMENT COMPANY (RYDE) LIMITED,02770844,Active,Private limited company,,,1992-12-04,,,98000,"30 Chatfield Lodge Newport PO30 1XR "
EASTMOUNT RESIDENTS ASSOCIATION LIMITED,03122648,Active,Private limited by guarantee without share capital,,,1995-11-06,,,98000,"30 Chatfield Lodge Newport PO30 1XR "
BRIGHT BROWN LIMITED,04849714,Active,Private limited company,,,2003-07-29,,,69201,"Exchange House, St. Cross Lane Newport Isle Of Wight PO30 5BZ "
RUBICON MOBILE LTD,05397209,Active,Private limited company,,,2005-03-17,,,62011,Spring Cottage Lynch Lane Calbourne Newport PO30 4JQ England
HYBRID MI LIMITED,14595000,Active,Private limited company,,,2023-01-16,,,29310,11 Melville Street Sandown PO36 8LF United Kingdom
BOILER 4 LIFE (IOW) LTD,10339284,Active,Private limited company,,,2016-08-22,,,77299,"C/O Apple Accountancy 5, Holyrood Street Newport PO30 5AU England"
BRIGHT PROPERTIES ( I OF W) LIMITED,09235909,Active,Private limited company,,,2014-09-25,,,55900,23 Hilton Road Gurnard PO31 8JB England
MELVILLE COURT MANAGEMENT COMPANY (RYDE) LIMITED,02545717,Active,Private limited company,,,1990-10-03,,,98000,"8 Gunville Road Newport PO30 5LB "
OUTBRAKE LTD,15162646,Active,Private limited company,,,2023-09-25,,,62011,"Unit 10, Hurstake Road Little London, Riverbank Estate Newport PO30 5UU England"
SCOTCHER CHIROPRACTIC LIMITED,05615188,Active,Private limited company,,,2005-11-08,,,86900,East Quay Kite Hill Wootton Bridge PO33 4LA England
KINGSTON AND GRIST LIMITED,04418743,Active,Private limited company,,,2002-04-17,,,68310 68320,East Quay Kite Hill Wootton Bridge PO33 4LA United Kingdom
HEARTWOOD DEVELOPMENTS (I.O.W.) LTD,09775019,Active,Private limited company,,,2015-09-14,,,41100,St Anthonys Convent Beatrice Avenue Shanklin PO37 6EN England
MOUNTAIN TOURS LTD,05479282,Active,Private limited company,,,2005-06-13,,,79110,"16c Sandown Road Lake Sandown PO36 9JP "
ISLE OF WIGHT FLOOD RESPONSE TEAM LIMITED,15249229,Active,Private limited company,,,2023-10-31,,,82990,1 Langley Court Pyle Street Newport PO30 1LA England
DATATEL NETWORKS LTD,07861975,Active,Private limited company,,,2011-11-28,,,61100,11 Quay Street 11 Quay Street Newport PO30 5BA United Kingdom
RENODRAIN LIMITED,14424252,Active,Private limited company,,,2022-10-17,,,81229,1 Langley Court Pyle Street Newport PO30 1LA England
JAM & SONS LIMITED,06736390,Active,Private limited company,,,2008-10-29,,,68209,Jam & Sons Ltd. Bridge Road Cowes PO31 7RA England
ONE DOOR DOWN LIMITED,08820931,Active,Private limited company,,,2013-12-19,,,68100,Dover House 6 Consort Rd Cowes PO31 7SQ England
JULES MANTLE EVENTS LIMITED,05566547,Active,Private limited company,,,2005-09-16,,,70229,"7 Consort Road Cowes PO31 7SQ "
WRM (IW) LTD,14491530,Active,Private limited company,,,2022-11-17,,,70229,Squirrels Ashlake Copse Lane Wootton Bridge Ryde PO33 4AG United Kingdom
SIGNATURA LIMITED,03251678,Active,Private limited company,,,1996-09-19,,,96090,"Unit 2 Porchfield Business Park Newtown Newport PO30 4QB "
EDWARDS ELECTRICAL (IW) LTD,10838313,Active,Private limited company,,,2017-06-27,,,43210,16b-C Sandown Road Lake Sandown PO36 9JP England
STEM CREW LTD,10009114,Active,Private limited company,,,2016-02-17,,,85320,Number One The Parade Cowes PO31 7QJ England
ISLE OF WIGHT BARS LTD,13596851,Active,Private limited company,,,2021-09-01,,,56210 56302,C/O Apple Accountancy 5 Holyrood Street Newport PO30 5AU England
PLOYON LTD,11554117,Active,Private limited company,,,2018-09-05,,,74909,Flat 2 Lynwood House 52 West Hill Road Ryde PO33 1LN United Kingdom
SUPERSTAR MUSIC LIMITED,00992549,Active,Private limited company,,,1970-10-23,,,90030,C/O The Robert Stigwood Organisation Ltd Suite 17 Mill Court Furrlongs Newport PO30 2AA United Kingdom
ABSOLUTE MARINE LTD,15830944,Active,Private limited company,,,2024-07-10,,,30120,1 Prospect Road Cowes PO31 7AD United Kingdom
TRACWARE LIMITED,03750993,Active,Private limited company,,,1999-04-13,,,62012,"Flat 2 52, West Hill Road Ryde PO33 1LN England"
FCG HOMECARE LIMITED,15034145,Active,Private limited company,,,2023-07-28,,,87300,Unit A4a Spithead Business Centre Newport Road Sandown PO36 9PH England
THE WILDHEART TRUST TRADING LIMITED,08058005,Active,Private limited company,,,2012-05-04,,,47789 56102,Granite Fort Yaverland Seafront Sandown PO36 8QB England
HARRY FERGUSON HOLDINGS LIMITED,01573192,Active,Private limited company,,,1981-07-09,,,82990,"Kings Manor Farm Copse Lane Freshwater PO40 9TL "
AMETHYST ECOLOGY LTD,15543952,Active,Private limited company,,,2024-03-06,,,74901,"Office 4, Baring Chambers Denmark Road Cowes PO31 7SY England"
INDEPENDENT ARTS,02147908,Active,Private limited by guarantee without share capital,,,1987-07-16,,,88100,48/49 High Street Newport PO30 1SE England
FRESHWATER YARMOUTH AND TOTLAND CIC,15980221,Active,Private limited by guarantee without share capital,Community Interest Company (CIC),,2024-09-26,,,81100,Freshwater Court Court Road Freshwater PO40 9NU United Kingdom
COTTAGE MEWS MANAGEMENT COMPANY LIMITED,02764397,Active,Private limited company,,,1992-11-13,,,98000,Cottage House Union Street Newport PO30 1PG England
22 CHURCH ROAD MANAGEMENT COMPANY LIMITED,04999141,Active,Private limited by guarantee without share capital,,,2003-12-18,,,98000,The Estate Office Beatrice Avenue East Cowes PO32 6LW England
NITON HARBOUR CLUB,09707336,Active,"Private Limited Company by guarantee without share capital, use of 'Limited' exemption",,,2015-07-28,,,74990,Southcliff Sandrock Road Niton Undercliff Ventnor PO38 2NQ England
PUBLIC HEALTHY LTD,14026590,Active,Private limited company,,,2022-04-05,,,74909,Greenbank Summers Lane Totland Bay PO39 0HL England
PLANNING & DEVELOPMENT HUB (IW) LIMITED,09877989,Active,Private limited company,,,2015-11-18,,,99999,"Unit 52, Branstone Business Park Stockmans Close Branstone Sandown PO36 0EQ England"
CARLTON DEVELOPMENTS (IOW) LTD,13214940,Active,Private limited company,,,2021-02-22,,,68310,Vision Accounting Fortis House Cothey Way Ryde PO33 1QT England
VECTAWAVE TECHNOLOGY LIMITED,03434858,Active,Private limited company,,,1997-09-16,,,26511,"Unit D The Apex St. Cross Business Park, Monks Brook Newport PO30 5XW "
PROPERTY DEVELOPMENTS (ISLE OF WIGHT) LIMITED,04635623,Active,Private limited company,,,2003-01-13,,,41100,"Fox Hollow Main Road Whiteley Bank Ventnor PO38 3AH "
SD CONSTRUCTION (IW) LIMITED,05956158,Active,Private limited company,,,2006-10-04,,,41202,"Exchange House St. Cross Lane Newport PO30 5BZ "
WIGHT WRITING LIMITED,13674713,Active,Private limited company,,,2021-10-12,,,70210,Vision Accounting Fortis House Cothey Way Ryde PO33 1QT England
SMOKING LOBSTER PRODUCTION LTD,14600652,Active,Private limited company,,,2023-01-18,,,10890,13 Church Road Gurnard PO31 8JP England
A.S.A REINFORCEMENT LIMITED,10686671,Active,Private limited company,,,2017-03-23,,,43390,5 St. Swithins Crescent Bouldnor Yarmouth PO41 0UT England
ERGONAUTIC BOATS LIMITED,12952147,Active,Private limited company,,,2020-10-14,,,30120,Shafleet House Main Road Newport PO30 4NS England
P & P DALE LIMITED,04927083,Receiver Action,Private limited company,,,2003-10-09,,,41100 68100 68209,1 Langley Court Pyle Street Newport PO30 1LA England
D. CHALLIS PROPERTY SERVICES LTD,05954331,Active,Private limited company,,,2006-10-03,,,43310 43320 43341 43390,"C/O Bright Brown Limited Exchange House St. Cross Lane Newport PO30 5BZ "
VECTIS OPTICAL LABORATORIES LIMITED,00873289,Active,Private limited company,,,1966-03-08,,,86900,"16 Quay Street Newport Isle Of Wight PO30 5BA "
HUDSON AND SON LIMITED,09711027,Active,Private limited company,,,2015-07-30,,,41202,64 St. Johns Wood Road Ryde PO33 1HL United Kingdom
WIGHT REMEDIAL BUILDING WORK LIMITED,04561561,Active,Private limited company,,,2002-10-14,,,43999,60 The Fairway Sandown PO36 9EG England
PINKEYE GRAPHICS LIMITED,06390057,Active,Private limited company,,,2007-10-04,,,62090 70210,"2 Somerville East Hill Road Ryde PO33 1LU "
LEIGH THOMAS & CO.LIMITED,00296008,Active,Private limited company,,,1935-01-09,,,68209,"North Court Main Road Shorwell Newport PO30 3JG "
SMART TRAINING AND RECRUITMENT LIMITED,04735396,Active,Private limited company,,,2003-04-15,,,85590,Suite 18 Mill Court Business Centre Furrlongs Newport PO30 2AA England
POWELL AND SONS IOW LIMITED,15999935,Active,Private limited company,,,2024-10-06,,,41202,1 South Bank Road East Cowes PO32 6JE United Kingdom
